id,name,gender,birth_date,birth_city,birth_country,birth_continent,alive,prize_year,prize_category,prize_sort_order,prize_portion,prize_status,prize_motivation,prize_amount_adjusted,prize_affiliation_name,prize_affiliation_city,prize_affiliation_country,age
296,Ivan Pavlov,male,1849,Ryazan,Russia,Europe,0,1904,Physiology or Medicine,1,1,received,"in recognition of his work on the physiology of digestion, through which knowledge on vital aspects of the subject has been transformed and enlarged",9549412,Military Medical Academy,St. Petersburg,Russia,55
98,Ivar Giaever,male,1929,Bergen,Norway,Europe,1,1973,Physics,2,1/4,received,"for their experimental discoveries regarding tunneling phenomena in semiconductors and superconductors, respectively",4095993,General Electric Company,"Schenectady, NY",USA,44
633,Ivo Andrić,male,1892,Dolac,Bosnia and Herzegovina,Europe,0,1961,Literature,1,1,received,for the epic force with which he has traced themes and depicted human destinies drawn from the history of his country,3538571,,,,69
130,J. Georg Bednorz,male,1950,Neuenkirchen,Germany,Europe,1,1987,Physics,1,1/2,received,for their important break-through in the discovery of superconductivity in ceramic materials,5255110,IBM Zurich Research Laboratory,Rüschlikon,Switzerland,37
80,J. Hans D. Jensen,male,1907,Hamburg,Germany,Europe,0,1963,Physics,3,1/4,received,for their discoveries concerning nuclear shell structure,3490429,University of Heidelberg,Heidelberg,Germany,56
763,J. M. Coetzee,male,1940,Cape Town,South Africa,Africa,1,2003,Literature,1,1,received,who in innumerable guises portrays the surprising involvement of the outsider,14515113,,,,63
440,J. Michael Bishop,male,1936,"York, PA",USA,North America,1,1989,Physiology or Medicine,1,1/2,received,for their discovery of the cellular origin of retroviral oncogenes,6444548,University of California School of Medicine,"San Francisco, CA",USA,53
930,J. Michael Kosterlitz,male,1943,Aberdeen,United Kingdom,Europe,1,2016,Physics,3,1/4,received,for theoretical discoveries of topological phase transitions and topological phases of matter,10204759,Brown University,"Providence, RI",USA,73
790,J. Robin Warren,male,1937,Adelaide,Australia,Oceania,0,2005,Physiology or Medicine,2,1/2,received,for their discovery of the bacterium <i>Helicobacter pylori</i> and its role in gastritis and peptic ulcer disease,14397252,,,,68
10,J.J. Thomson,male,1856,Cheetham Hill,United Kingdom,Europe,0,1906,Physics,1,1,received,in recognition of the great merits of his theoretical and experimental investigations on the conduction of electricity by gases,9123585,University of Cambridge,Cambridge,United Kingdom,50
592,Jacinto Benavente,male,1866,Madrid,Spain,Europe,0,1922,Literature,1,1,received,for the happy manner in which he has continued the illustrious traditions of the Spanish drama,3867443,,,,56
728,Jack Kilby,male,1923,"Jefferson City, MO",USA,North America,0,2000,Physics,3,1/2,received,for his part in the invention of the integrated circuit,13932169,Texas Instruments,"Dallas, TX",USA,77
134,Jack Steinberger,male,1921,Bad Kissingen,Germany,Europe,0,1988,Physics,3,1/3,received,for the neutrino beam method and the demonstration of the doublet structure of the leptons through the discovery of the muon neutrino,5711100,CERN,Geneva,Switzerland,67
837,Jack W. Szostak,male,1952,London,United Kingdom,Europe,1,2009,Physiology or Medicine,3,1/3,received,for the discovery of how chromosomes are protected by telomeres and the enzyme telomerase,13471654,Harvard Medical School,"Boston, MA",USA,57
160,Jacobus H. van 't Hoff,male,1852,Rotterdam,the Netherlands,Europe,0,1901,Chemistry,1,1,received,in recognition of the extraordinary services he has rendered by the discovery of the laws of chemical dynamics and osmotic pressure in solutions,10531894,Berlin University,Berlin,Germany,49
944,Jacques Dubochet,male,1942,Aigle,Switzerland,Europe,1,2017,Chemistry,1,1/3,received,for developing cryo-electron microscopy for the high-resolution structure determination of biomolecules in solution,11280587,University of Lausanne,Lausanne,Switzerland,75
382,Jacques Monod,male,1910,Paris,France,Europe,0,1965,Physiology or Medicine,3,1/3,received,for their discoveries concerning genetic control of enzyme and virus synthesis,3421105,Institut Pasteur,Paris,France,55
715,James A. Mirrlees,male,1936,Minnigaff,Scotland,Europe,0,1996,Economic Sciences,1,1/2,received,for their fundamental contributions to the economic theory of incentives under asymmetric information,11666895,University of Cambridge,Cambridge,United Kingdom,60
204,James B. Sumner,male,1887,"Canton, MA",USA,North America,0,1946,Chemistry,1,1/2,received,for his discovery that enzymes can be crystallized,3078163,Cornell University,"Ithaca, NY",USA,59
41,James Chadwick,male,1891,Manchester,United Kingdom,Europe,0,1935,Physics,1,1,received,for the discovery of the neutron,6143478,Liverpool University,Liverpool,United Kingdom,44
116,James Cronin,male,1931,"Chicago, IL",USA,North America,0,1980,Physics,1,1/2,received,for the discovery of violations of fundamental symmetry principles in the decay of neutral K-mesons,3552364,University of Chicago,"Chicago, IL",USA,49
690,James E. Meade,male,1907,Swanage,United Kingdom,Europe,0,1977,Economic Sciences,2,1/2,received,for their pathbreaking contribution to the theory of international trade and international capital movements,3787559,University of Cambridge,Cambridge,United Kingdom,70
884,James E. Rothman,male,1950,"Haverhill, MA",USA,North America,1,2013,Physiology or Medicine,1,1/3,received,"for their discoveries of machinery regulating vesicle traffic, a major transport system in our cells",10284439,Yale University,"New Haven, CT",USA,63
30,James Franck,male,1882,Hamburg,Germany,Europe,0,1925,Physics,1,1/2,received,for their discovery of the laws governing the impact of an electron upon an atom,3947396,Goettingen University,Göttingen,Germany,43
732,James J. Heckman,male,1944,"Chicago, IL",USA,North America,1,2000,Economic Sciences,1,1/2,received,for his development of theory and methods for analyzing selective samples,13932169,University of Chicago,"Chicago, IL",USA,56
700,James M. Buchanan Jr.,male,1919,"Murfreesboro, TN",USA,North America,0,1986,Economic Sciences,1,1,received,for his development of the contractual and constitutional bases for the theory of economic and political decision-making,5038251,Center for Study of Public Choice,"Fairfax, VA",USA,67
958,James P. Allison,male,1948,"Alice, TX",USA,North America,1,2018,Physiology or Medicine,1,1/2,received,for their discovery of cancer therapy by inhibition of negative immune regulation,11064000,Parker Institute for Cancer Immunotherapy,"San Francisco, CA",USA,70
973,James Peebles,male,1935,Winnipeg,Canada,North America,1,2019,Physics,1,1/2,received,for theoretical discoveries in physical cosmology,10866946,Princeton University,"Princeton, NJ",USA,84
104,James Rainwater,male,1917,"Council, ID",USA,North America,0,1975,Physics,3,1/3,received,for the discovery of the connection between collective motion and particle motion in atomic nuclei and the development of the theory of the structure of the atomic nucleus based on this connection,4184870,Columbia University,"New York, NY",USA,58
695,James Tobin,male,1918,"Champaign, IL",USA,North America,0,1981,Economic Sciences,1,1,received,"for his analysis of financial markets and their relations to expenditure decisions, employment, production and prices",3601563,Yale University,"New Haven, CT",USA,63
373,James Watson,male,1928,"Chicago, IL",USA,North America,1,1962,Physiology or Medicine,2,1/3,received,for their discoveries concerning the molecular structure of nucleic acids and its significance for information transfer in living material,3487601,Harvard University,"Cambridge, MA",USA,34
678,Jan Tinbergen,male,1903,the Hague,the Netherlands,Europe,0,1969,Economic Sciences,2,1/2,received,for having developed and applied dynamic models for the analysis of economic processes,3911199,The Netherlands School of Economics,Rotterdam,the Netherlands,66
496,Jane Addams,female,1860,"Cedarville, IL",USA,North America,0,1931,Peace,1,1/2,received,for their assiduous effort to revive the ideal of peace and to rekindle the spirit of peace in their own nation and in the whole of mankind,6439352,,,,71
223,Jaroslav Heyrovsky,male,1890,Prague,Czech Republic,Europe,0,1959,Chemistry,1,1,received,for his discovery and development of the polarographic methods of analysis,3324593,Polarographic Institute of the Czechoslovak Academy of Science,Prague,Czech Republic,69
661,Jaroslav Seifert,male,1901,Prague,Czech Republic,Europe,0,1984,Literature,1,1,received,"for his poetry which endowed with freshness, sensuality and rich inventiveness provides a liberating image of the indomitable spirit and versatility of man",4649450,,,,83
32,Jean Baptiste Perrin,male,1870,Lille,France,Europe,0,1926,Physics,1,1,received,"for his work on the discontinuous structure of matter, and especially for his discovery of sedimentation equilibrium",4023773,Sorbonne University,Paris,France,56
420,Jean Dausset,male,1916,Toulouse,France,Europe,0,1980,Physiology or Medicine,2,1/3,received,for their discoveries concerning genetically determined structures on the cell surface that regulate immunological reactions,3552364,"Université de Paris, Laboratoire Immuno-Hématologie",Paris,France,64
915,Jean Tirole,male,1953,Troyes,France,Europe,1,2014,Economic Sciences,1,1,received,for his analysis of market power and regulation,10301676,Toulouse School of Economics (TSE),Toulouse,France,61
832,Jean-Marie Gustave Le Clézio,male,1940,Nice,France,Europe,1,2008,Literature,1,1,received,"author of new departures, poetic adventure and sensual ecstasy, explorer of a humanity beyond and below the reigning civilization",13432401,,,,68
268,Jean-Marie Lehn,male,1939,Rosheim,France,Europe,1,1987,Chemistry,2,1/3,received,for their development and use of molecules with structure-specific interactions of high selectivity,5255110,Université Louis Pasteur,Strasbourg,France,48
637,Jean-Paul Sartre,male,1905,Paris,France,Europe,0,1964,Literature,1,1,declined,"for his work which, rich in ideas and filled with the spirit of freedom and the quest for truth, has exerted a far-reaching influence on our age",3476602,,,,59
931,Jean-Pierre Sauvage,male,1944,Paris,France,Europe,1,2016,Chemistry,1,1/3,received,for the design and synthesis of molecular machines,10204759,University of Strasbourg,Strasbourg,France,72
938,Jeffrey C. Hall,male,1945,"New York, NY",USA,North America,1,2017,Physiology or Medicine,1,1/3,received,for their discoveries of molecular mechanisms controlling the circadian rhythm,11280587,University of Maine,"Maine, ME",USA,72
992,Jennifer A. Doudna,female,1964,"Washington, D.C.",USA,North America,1,2020,Chemistry,2,1/2,received,for the development of a method for genome editing,12017727,University of California,"Berkeley, CA",USA,56
289,Jens C. Skou,male,1918,Lemvig,Denmark,Europe,0,1997,Chemistry,3,1/2,received,"for the first discovery of an ion-transporting enzyme, Na+, K+ -ATPase",11768210,Aarhus University,Aarhus,Denmark,79
138,Jerome I. Friedman,male,1930,"Chicago, IL",USA,North America,1,1990,Physics,1,1/3,received,"for their pioneering investigations concerning deep inelastic scattering of electrons on protons and bound neutrons, which have been of essential importance for the development of the quark model in particle physics",7780591,Massachusetts Institute of Technology (MIT),"Cambridge, MA",USA,60
263,Jerome Karle,male,1918,"New York, NY",USA,North America,0,1985,Chemistry,2,1/2,received,for their outstanding achievements in the development of direct methods for the determination of crystal structures,4725513,US Naval Research Laboratory,"Washington, D.C.",USA,67
762,Jimmy Carter,male,1924,"Plains, GA",USA,North America,1,2002,Peace,1,1,received,"for his decades of untiring effort to find peaceful solutions to international conflicts, to advance democracy and human rights, and to promote economic and social development",14794608,,,,78
945,Joachim Frank,male,1940,Siegen,Germany,Europe,1,2017,Chemistry,2,1/3,received,for developing cryo-electron microscopy for the high-resolution structure determination of biomolecules in solution,11280587,Columbia University,"New York, NY",USA,77
565,Jody Williams,female,1950,"Rutland, VT",USA,North America,1,1997,Peace,2,1/2,received,for their work for the banning and clearing of anti-personnel mines,11768210,,,,47
270,Johann Deisenhofer,male,1943,Zusamaltheim,Germany,Europe,1,1988,Chemistry,1,1/3,received,for the determination of the three-dimensional structure of a photosynthetic reaction centre,5711100,University of Texas Southwestern Medical Center at Dallas,"Dallas, TX",USA,45
15,Johannes Diderik van der Waals,male,1837,Leiden,the Netherlands,Europe,0,1910,Physics,1,1,received,for his work on the equation of state for gases and liquids,8765417,Amsterdam University,Amsterdam,the Netherlands,73
316,Johannes Fibiger,male,1867,Silkeborg,Denmark,Europe,0,1926,Physiology or Medicine,1,1,received,for his discovery of the Spiroptera carcinoma,4023773,Copenhagen University,Copenhagen,Denmark,59
24,Johannes Stark,male,1874,Schickenhof,Germany,Europe,0,1919,Physics,1,1,received,for his discovery of the Doppler effect in canal rays and the splitting of spectral lines in electric fields,2922455,Greifswald University,Greifswald,Germany,45
614,Johannes V. Jensen,male,1873,Farsø,Denmark,Europe,0,1944,Literature,1,1,received,"for the rare strength and fertility of his poetic imagination with which is combined an intellectual curiosity of wide scope and a bold, freshly creative style",3086192,,,,71
756,John B. Fenn,male,1917,"New York, NY",USA,North America,0,2002,Chemistry,1,1/4,received,for their development of soft desorption ionisation methods for mass spectrometric analyses of biological macromolecules,14794608,Virginia Commonwealth University,"Richmond, VA",USA,85
976,John B. Goodenough,male,1922,Jena,Germany,Europe,0,2019,Chemistry,1,1/3,received,for the development of lithium-ion batteries,10866946,University of Texas,"Austin, TX",USA,97
66,John Bardeen,male,1908,"Madison, WI",USA,North America,0,1956,Physics,2,1/3,received,for their researches on semiconductors and their discovery of the transistor effect,3318586,University of Illinois,"Urbana, IL",USA,48
66,John Bardeen,male,1908,"Madison, WI",USA,North America,0,1972,Physics,1,1/3,received,"for their jointly developed theory of superconductivity, usually called the BCS-theory",4113011,University of Illinois,"Urbana, IL",USA,64
711,John C. Harsanyi,male,1920,Budapest,Hungary,Europe,0,1994,Economic Sciences,1,1/3,received,for their pioneering analysis of equilibria in the theory of non-cooperative games,11370684,University of California,"Berkeley, CA",USA,74
227,John C. Kendrew,male,1917,Oxford,United Kingdom,Europe,0,1962,Chemistry,2,1/2,received,for their studies of the structures of globular proteins,3487601,MRC Laboratory of Molecular Biology,Cambridge,United Kingdom,45
804,John C. Mather,male,1946,"Roanoke, VA",USA,North America,1,2006,Physics,1,1/2,received,for their discovery of the blackbody form and anisotropy of the cosmic microwave background radiation,14202095,NASA Goddard Space Flight Center,"Greenbelt, MD",USA,60
266,John C. Polanyi,male,1929,Berlin,Germany,Europe,1,1986,Chemistry,3,1/3,received,for their contributions concerning the dynamics of chemical elementary processes,5038251,University of Toronto,Toronto,Canada,57
1013,John Clauser,male,1942,"Pasadena, CA",USA,North America,1,2022,Physics,2,1/3,received,"for experiments with entangled photons, establishing the violation of Bell inequalities and  pioneering quantum information science",10852166,J.F. Clauser & Assoc.,"Walnut Creek, CA",USA,80
56,John Cockcroft,male,1897,Todmorden,United Kingdom,Europe,0,1951,Physics,1,1/2,received,for their pioneer work on the transmutation of atomic nuclei by artificially accelerated atomic particles,3302100,Atomic Energy Research Establishment,"Harwell, Berkshire",United Kingdom,54
247,John Cornforth,male,1917,Sydney,Australia,Oceania,0,1975,Chemistry,1,1/2,received,for his work on the stereochemistry of enzyme-catalyzed reactions,4184870,University of Sussex,Brighton,United Kingdom,58
752,John E. Sulston,male,1942,Cambridge,United Kingdom,Europe,0,2002,Physiology or Medicine,3,1/3,received,for their discoveries concerning genetic regulation of organ development and programmed cell death',14794608,The Wellcome Trust Sanger Institute,Cambridge,United Kingdom,60
288,John E. Walker,male,1941,Halifax,United Kingdom,Europe,1,1997,Chemistry,2,1/4,received,for their elucidation of the enzymatic mechanism underlying the synthesis of adenosine triphosphate (ATP),11768210,MRC Laboratory of Molecular Biology,Cambridge,United Kingdom,56
356,John F. Enders,male,1897,"West Hartford, CT",USA,North America,0,1954,Physiology or Medicine,1,1/3,received,for their discovery of the ability of poliomyelitis viruses to grow in cultures of various types of tissue,3245708,Harvard Medical School,"Boston, MA",USA,57
712,John F. Nash Jr.,male,1928,"Bluefield, WV",USA,North America,0,1994,Economic Sciences,2,1/3,received,for their pioneering analysis of equilibria in the theory of non-cooperative games,11370684,Princeton University,"Princeton, NJ",USA,66
605,John Galsworthy,male,1867,Kingston Hill,United Kingdom,Europe,0,1932,Literature,1,1,received,for his distinguished art of narration which takes its highest form in <I>The Forsyte Saga</I>,6490011,,,,65
205,John H. Northrop,male,1891,"Yonkers, NY",USA,North America,0,1946,Chemistry,2,1/4,received,for their preparation of enzymes and virus proteins in a pure form,3078163,Rockefeller Institute for Medical Research,"Princeton, NJ",USA,55
109,John H. Van Vleck,male,1899,"Middletown, CT",USA,North America,0,1977,Physics,3,1/3,received,for their fundamental theoretical investigations of the electronic structure of magnetic and disordered systems,3787559,Harvard University,"Cambridge, MA",USA,78
566,John Hume,male,1937,Londonderry,Northern Ireland,Europe,0,1998,Peace,1,1/2,received,for their efforts to find a peaceful solution to the conflict in Northern Ireland,11941377,,,,61
792,John L. Hall,male,1934,"Denver, CO",USA,North America,1,2005,Physics,2,1/4,received,"for their contributions to the development of laser-based precision spectroscopy, including the optical frequency comb technique",14397252,"University of Colorado, JILA","Boulder, CO",USA,71
314,John Macleod,male,1876,Cluny,Scotland,Europe,0,1923,Physiology or Medicine,2,1/2,received,for the discovery of insulin,3895958,University of Toronto,Toronto,Canada,47
903,John O'Keefe,male,1939,"New York, NY",USA,North America,1,2014,Physiology or Medicine,1,1/2,received,for their discoveries of cells that constitute a positioning system in the brain,10301676,University College,London,United Kingdom,75
291,John Pople,male,1925,Burnham-on-Sea,United Kingdom,Europe,0,1998,Chemistry,2,1/2,received,for his development of computational methods in quantum chemistry,11941377,Northwestern University,"Evanston, IL",USA,73
681,John R. Hicks,male,1904,Warwick,United Kingdom,Europe,0,1972,Economic Sciences,1,1/2,received,for their pioneering contributions to general economic equilibrium theory and welfare theory,4113011,All Souls College,Oxford,United Kingdom,68
507,John R. Mott,male,1865,"Livingston Manor, NY",USA,North America,0,1946,Peace,2,1/2,received,for his contribution to the creation of a peace-promoting religious brotherhood across national boundaries,3078163,,,,81
427,John R. Vane,male,1927,Tardebigg,United Kingdom,Europe,0,1982,Physiology or Medicine,3,1/3,received,for their discoveries concerning prostaglandins and related biologically active substances,3814029,The Wellcome Research Laboratories,Beckenham,United Kingdom,55
634,John Steinbeck,male,1902,"Salinas, CA",USA,North America,0,1962,Literature,1,1,received,"for his realistic and imaginative writings, combining as they do sympathetic humour and keen social perception",3487601,,,,60
1032,Jon Fosse,male,1959,Haugesund,Norway,Europe,1,2023,Literature,1,1,received,for his innovative plays and prose which give voice to the unsayable,11000000,,,,64
574,José Echegaray,male,1832,Madrid,Spain,Europe,0,1904,Literature,2,1/2,received,"in recognition of the numerous and brilliant compositions which, in an individual and original manner, have revived the great traditions of the Spanish drama",9549412,,,,72
563,José Ramos-Horta,male,1949,Dili,East Timor,Oceania,1,1996,Peace,2,1/2,received,for their work towards a just and peaceful solution to the conflict in East Timor,11666895,,,,47
675,José Saramago,male,1922,Azinhaga,Portugal,Europe,0,1998,Literature,1,1,received,"who with parables sustained by imagination, compassion and irony continually enables us once again to apprehend an elusory reality",11941377,,,,76
664,Joseph Brodsky,male,1940,St. Petersburg,Russia,Europe,0,1987,Literature,1,1,received,"for an all-embracing authorship, imbued with clarity of thought and poetic intensity",5255110,,,,47
442,Joseph E. Murray,male,1919,"Milford, MA",USA,North America,0,1990,Physiology or Medicine,1,1/2,received,for their discoveries concerning organ and cell transplantation in the treatment of human disease,7780591,Brigham and Women's Hospital,"Boston, MA",USA,71
746,Joseph E. Stiglitz,male,1943,"Gary, IN",USA,North America,1,2001,Economic Sciences,3,1/3,received,for their analyses of markets with asymmetric information,15114754,Columbia University,"New York, NY",USA,58
337,Joseph Erlanger,male,1874,"San Francisco, CA",USA,North America,0,1944,Physiology or Medicine,1,1/2,received,for their discoveries relating to the highly differentiated functions of single nerve fibres,3086192,Washington University,"St. Louis, MO",USA,70
144,Joseph H. Taylor Jr.,male,1941,"Philadelphia, PA",USA,North America,1,1993,Physics,2,1/2,received,"for the discovery of a new type of pulsar, a discovery that has opened up new possibilities for the study of gravitation",11118431,Princeton University,"Princeton, NJ",USA,52
433,Joseph L. Goldstein,male,1940,"Sumter, SC",USA,North America,1,1985,Physiology or Medicine,2,1/2,received,for their discoveries concerning the regulation of cholesterol metabolism,4725513,University of Texas Southwestern Medical Center at Dallas,"Dallas, TX",USA,45
560,Joseph Rotblat,male,1908,Warsaw,Poland,Europe,0,1995,Peace,1,1/2,received,"for their efforts to diminish the part played by nuclear arms in international politics and, in the longer run, to eliminate such arms",11406186,,,,87
1008,Joshua D. Angrist,male,1960,"Columbus, OH",USA,North America,1,2021,Economic Sciences,2,1/4,received,for their methodological contributions to the analysis of causal relationships,11760204,Massachusetts Institute of Technology (MIT),"Cambridge, MA",USA,61
366,Joshua Lederberg,male,1925,"Montclair, NJ",USA,North America,0,1958,Physiology or Medicine,3,1/2,received,for his discoveries concerning genetic recombination and the organization of the genetic material of bacteria,3253674,University of Wisconsin,"Madison, WI",USA,33
934,Juan Manuel Santos,male,1951,Bogotá,Colombia,South America,1,2016,Peace,1,1,received,for his resolute efforts to bring the country's more than 50-year-long civil war to an end,10204759,,,,65
627,Juan Ramón Jiménez,male,1881,Moguer,Spain,Europe,0,1956,Literature,1,1,received,"for his lyrical poetry, which in Spanish language constitutes an example of high spirit and artistical purity",3318586,,,,75
862,Jules A. Hoffmann,male,1941,Echternach,Luxembourg,Europe,1,2011,Physiology or Medicine,2,1/4,received,for their discoveries concerning the activation of innate immunity,12964004,University of Strasbourg,Strasbourg,France,70
309,Jules Bordet,male,1870,Soignies,Belgium,Europe,0,1919,Physiology or Medicine,1,1,received,for his discoveries relating to immunity,2922455,Brussels University,Brussels,Belgium,49
85,Julian Schwinger,male,1918,"New York, NY",USA,North America,0,1965,Physics,2,1/3,received,"for their fundamental work in quantum electrodynamics, with deep-ploughing consequences for the physics of elementary particles",3421105,Harvard University,"Cambridge, MA",USA,47
396,Julius Axelrod,male,1912,"New York, NY",USA,North America,0,1970,Physiology or Medicine,3,1/3,received,"for their discoveries concerning the humoral transmitters in the nerve terminals and the mechanism for their storage, release and inactivation",3906780,National Institutes of Health,"Bethesda, MD",USA,58
317,Julius Wagner-Jauregg,male,1857,Wels,Austria,Europe,0,1927,Physiology or Medicine,1,1,received,for his discovery of the therapeutic value of malaria inoculation in the treatment of dementia paralytica,4417952,Vienna University,Vienna,Austria,70
131,K. Alex Müller,male,1927,Basel,Switzerland,Europe,0,1987,Physics,2,1/2,received,for their important break-through in the discovery of superconductivity in ceramic materials,5255110,IBM Zurich Research Laboratory,Rüschlikon,Switzerland,60
743,K. Barry Sharpless,male,1941,"Philadelphia, PA",USA,North America,1,2001,Chemistry,3,1/2,received,for his work on chirally catalysed oxidation reactions,15114754,The Scripps Research Institute,"La Jolla, CA",USA,60
743,K. Barry Sharpless,male,1941,"Philadelphia, PA",USA,North America,1,2022,Chemistry,3,1/3,received,for the development of click chemistry and bioorthogonal chemistry,10852166,Scripps Research,"La Jolla, CA",USA,81
120,Kai M. Siegbahn,male,1918,Lund,Sweden,Europe,0,1981,Physics,3,1/2,received,for his contribution to the development of high-resolution electron spectroscopy,3601563,Uppsala University,Uppsala,Sweden,63
913,Kailash Satyarthi,male,1954,Vidisha,India,Asia,1,2014,Peace,1,1/2,received,for their struggle against the suppression of children and young people and for the right of all children to education,10301676,,,,60
